I made a new recipe for peasant bread, and it came out spectacular!
The cake I made today came out amazing. It tasted amazing as well.
My son woke me up to a fantastic breakfast of eggs, his special hamburger patty and pancakes.
I consumed a well garnished bowl of ramen twice today. It was so delicious.
I cooked and ate a wonderful sausage and cheese omelet.
I ate a very good dinner with my family
my partner buy a big cake for me its very nice and tasty .i never expect the cake from my partner he really loves me lot .the cake is very delicious and very cold .the taste was very different compared to other cake .the day was went very interesting and i spent most of the time with my partner .we went to movie and we had a fun .i really miss my partner and after that most of the day i love to spent with him.
I slow cooked a chuck roast on my stove that came out great.
I cooked my girlfriend a wonderful breakfast.
i finally learned to cook chicken

I took my girlfriend out for a nice Birthday dinner and got to watch her open her presents. It was a really fun evening.
I went to the grocery store to buy a cooked whole chicken from the deli and found that it was half-price for the day.
I finally mastered how to make crispy tofu.
I ate some peanut butter M&Ms while watching John Oliver. They were delicious and he was hilarious.
I went out for dinner with my friends and enjoyed a lot.
I cooked a new recipe for dinner and it turned out great
My girlfriend surprised me with my favorite dinner (tacos).
I was able to resist drink last night.
I cooked food for my mother-in-law.  And she liked it too
I cooked an entire breakfast for my family.
I had a very delicious lunch
I had really good carbonara chicken for dinner.
I was able to eat out for dinner with one of her best friends.
So happy that I Had yummy mango after a year today.
I ate really good chinese food.
I could finally eat at my favourite restaurant after a long time.
I recently became friends with a really great group of people. Yesterday we ordered pizza, Chinese, and taco bell. Then we sat around talking and eating. Good times.Talking to my sister in law, eating some chocolate custard, and spending some time with my youngest child

When I got home from work, my girlfriend greeted me with a hug, and dinner already prepared and setup on the table.
When I woke my young daughter up this morning for school, she insisted that she would make breakfast which consisted of coffee and toast.
Reading comics books whilst drinking cocoa drink.
I eat Sugar candy in a party after such a long. It reminds me of my childhood.
I went to get sushi with my high-school friends, and it was like a small reunion.
I got an offer for a pizza from my nearby hotel and i was happy
I made a tasty chocolate pudding, and every one enjoyed it.
My husband made me my favorite food for dinner.
Participated in ugadi food festival in office
I was able to stay under 700 calories yesterday and continue my fast so I can eat out with my friends this weekend.
my maid cooked a delicious meal today for my family
Like I said up  above I wake up early to get started on mturk, Yesterday morning my daughter stoped and got me coffee in the morning. It was nice  and much needed.
I made a delicious homemade Pad Thai and my husband was so happy to eat it and give so many compliments.
My job provided lunch and it was really good.
I cooked dinner with my son, we made meatballs.
I made a delicious meal using fresh ingredients without having to go to the grocery store.
I ate my favorite dinner.
I shared a big breakfast with my boyfriend
My cat has been sick and yesterday she ate some food and scampered around the apartment.
i completed all my office work and went for a nice brunch with my parter
I made tea this morning with ginger. My wife liked it very much and this made me happy.
I had a great dinner with baked chicken, hominy, bread and a salad.
My mom took us to dinner and I ate a shrimp chimichanga
A good dinner in a nice restaurant with coworkers.
I had lunch with a friend I hadn't seen in awhile.
i ate my favourite food item for lunch
My husband made a delicious breakfast.
I had dinner with my family. We went to a new restaurant nearby.
I drank 6 12 ounces glasses of water.
I made a cake and it was very tasty and everyone at home enjoyed it
Finally succeed in making Tomato soup.
After dinner, I was able to enjoy a quiet moment on the porch with coffee and a cigar.
I and my friends went to my favourite restaurant. We ate all the special dishes there. We all went astonished in taste and delicacy
I spent some time in the kitchen making chicken soup.
I cooked a tasty dinner from leftovers.
I satisfied my many food cravings for dinner.
When my son took me out to eat at a very nice restaurant.
I made a delicious meal.
Getting an approval for coffee with a girl I have crush on.
A bakery gave me their extra pastries at the end of the day
The pork I cooked for dinner last night turned out well, I was worried it wouldn't.
I had a wonderful meal with my girl
Enjoying my key lime yogurt in the morning for breakfast
My old friend Renee invited me out to dinner.
What made me happy was getting some lunch that felt fulfilling, even if it was a burger and fries.
I had enough time to make some doro wat chicken store with berbere sauce, it was great.
I was able to go to a restaurant that I like.
I had a great cup of coffee when I woke up.
I went grocery shopping to purchase food to cook for my wife and myself.
I made a pizza at home with my wife and it was delicious.
I had a piece of the richest, most moist chocolate cake I've ever had.
I went out last night and a friend made me an awesome drink with chocolate syrup and bailey's irish cream.
I had a giant chocolate cup cake.
I hung out with a close friend last night and had dinner and drinks with him.
My wife made her chicken soup.
Going to the gym during my lunch break made me happy
I went out to eat at my favorite burger joint. The burgers were so delicious, I was in complete bliss.
I was happy because I went to dinner last night with friends I hadn't seen months.
Coffee has made me incredibly happy.
I was happy when I got home from work and ate a piece of tiramisu that my wife had made.
After lunch, I took a long walk around the block near my office where there is lots of sun and not many cars that are passing by.
I went out with friends to have drinks at a bar.
I met with a friend for lunch and had a nice time socializing.
My roommate made me breakfast this morning.

My husband was very kind and sweet in the morning. He sat and talked to me. We ate breakfast for me. He waited to see me.
My teen daughter made me a cup of tea last night and set it next to my bed.
I got to eat some really delicious noodles that my mom made.
I received from free sushi from a coworker
My friend treated me to a nice lunch. It was seafood and delicious. I didn't have to pay for anything.
I managed to eat under my calorie goal for the day and felt accomplished.
I enjoyed a cup of coffee this morning.
Watching Bob's Burgers streaming on Fox.
I ate a nice dinner which had a delicious steak.
Eating my sriracha and sour cream mashed potatoes that turned out exceptionally well.
A friend took me to lunch today.
I made myself a delicious cheeseburger this afternoon. It came out great.
I found fifty dollars on the floor and I was broke and I needed to buy some lunch.
That the weather was nice and planted the first vegetables of the season. They should grow in this weather nicely.
Coworker brought in donuts for breakfast
I got Chinese food for dinner, it was good.
It made me happy when I got to get some fries for lunch earlier
I ate a delicious dinner with my husband.
I finished making a mega cake for a friend's birthday and it came out great!
I got Korean barbecue from a nearby food cart.
I made a big dinner with my girlfriend last evening.
I went to a local bar and had dinner with an old friend.
I saw my son trying to make a grilled cheese on the stove, and it wasn't working so well, the bread was falling apart and the cheese was burning. I came over and helped him, and he made one on his own too and we ate them together. It made me feel warm to teach him something, even so simple.
I cooked a new recipe I've been wanting to try. It turned out well.
I ate pretty healthy today and felt good about myself.
I met up with a few friends for some tea and a Bible study session, it was really fun and engaging.
Got to eat dinner with the girlfriend and we sat at the bar so I can watch the game.
I had cream of chicken soup for dinner. It made me feel a lot better because I have been sick.
I was given $10 by a stranger in line for coffee today.
I went to In n Out after work and I was starving. The double double tasted so good
I ate chik-fil-a
I enjoyed cooking ribs for dinner tonight.
I saw a great blue heron catching a small fish by the creek out back.
I was texting with my boyfriend, and I mentioned I liked a new beer I was trying. He replied, "Noted."
Going to Tucker's ice cream parlor and getting some burgundy cherry ice cream.
Drinking a beer right now in the past 24 hours is making me happy.
I made an amazing dinner of garlic and butter noodles.  It had the perfect amount of salt, butter, and Parmesan cheese.  It made my mouth really happy.
When I ate my salad for lunch it was so good.
I made delicious rice pudding
I ate delicious rice pudding
I complete 5 Mturk surveys
I taught my dog a new trick
I received a check in the mail
Going to dunkin' donuts and getting a free dozen of them made me happy today.
I had a delicious lunch today.
I got a burger for lunch and it was cooked perfectly because it wasn't too rare or too well-done.
Cooking dinner with my boyfriend.
I ate chicken, rice, and vegetables for lunch.
I had a really fun night out  at a bar with an old friend.
I made the perfect pot of coffee, it had great flavor.
My coffee this morning was especially good and it made me very happy.
I am a Type 1 Diabetic.  Today, my blood sugars were in a good range all day.
I bought a freshly made smoothie from our cafeteria.
I went to dinner with my roommates and laughed until my stomach hurt.
I cooked and ate a satisfying meal for my wife and I.
I made a grilled cheese and had a beer with it after I mowed -- I love both of those things.
I received a discount for my coffee.
I had a great meal
I ate a type of candy that reminded me of my childhood.
I ate my favorite food, chicken alfredo.
I prepped oatmeal for a few months so I have plenty of great breakfasts ready.
I found 14 high quality fuji apples for the very cheap price of 9.99.
I got a piece of candy from my friend.
I tried real butter for the first time.
Eating a great seitan bowl yesterday made me thrilled.
I found my favorite beer at a local store.
I was happy when I woke up to a cup of coffee.
My dog finished all his food for the first time in a few days.
I had lunch with a friend and found out that another friend is going to be a bartender at the place.
I enjoyed tending to my garden, getting my hands dirty and spending time watering and taking care of my vegetable garden.

A friend made dinner for me.
I ate fish today.
I ate a nice, juicy steak for dinner.
I had a great lunch with a former co-worker of mine. I had not seen him for months and we caught up
My mother brought by Japaneses food for lunch and it was delicious.
I ate some good food
My partner made me a romantic meal to congratulate me for my new job.
I ate healthier.
I went to dinner with my girlfriend to one our favorite Chinese restaurants.
I ate a delicious supper last evening.
Eating my favorite meal from a take out restaurant.
My husband made dinner! There were left overs he makes the best scampi
Some vegetables that I had planted had sprouted and I saw green poking through the soil this morning.
Cooked and ate a delicious steak.
I drank a tasty green tea latte that I made.
That first sip of coffee that I had this morning
A tasty dinner yesterday.
I ate a delicious chocolate fudge brownie.
I decided to splurge and get a Caffe Latte from Starbucks this morning, and I savored it.
I ate some of my favorite meals (including bourbon steak) for dinner.
I got to go get some chinese food, I hadnt had any in a long time.
I had a peanut butter and jelly sandwich for lunch. It reminded me of my childhood.
I made tacos for dinner . The tacos turned out well.  My daughter was here for dinner and she ate tacos with my husband and me.
I tried out a new recipe and it turned out really well.
I had a very tasty luch at one of my favorite places
I had excellent dinner
My wife cooked me a surprise dinner to take to work with me.
The workers at Chickfila (a fast food restaurant) are always so kind and happy. Their smiles are contagious!
I ate tacos.
I found some lime green chiffon fabric at a good price.
I had some ice cream after dinner.
I ate some pizza. I love pizza, so that made me pretty happy. I was also pretty happy the crust was nice and doughy and wasn't burnt. I'd still have been happy if the pizza didn't have doughy crust, but really the doughy crust added to the happiness.
I ate a hearty breakfast of bacon, eggs, biscuits, and hash browns which left me completely sated.
Eating a delicious dinner
My answer going to sound pathetic because I can't even remember what made me happy or if I'm smiling or not in the last 24 hours, I'm such a sad rotten potato.
I went to a place to eat with my gf. We went to applebees and had a wonderful time together.
I ate a juicy piece of pizza. I have not had pizza in a long time. This made me so happy.
When I ate at the restaurant
I was really happy when my girlfriend got into the top engineering program in the nation. I baked her a cake and took her out to dinner.
I ordered pizza, and the rare treat tasted delicious.
I had my favorite food, a cheesesteak, for lunch.
Went to my favorite spot for lunch today.
Ate dinner with my family, at the table together.
My husband told me I didn't have to cook. He is getting food on the way home from work.
I got to eat some very delicious chocolate chip cookie dough.
It made me happy to eat chic-a-fila for lunch because it is my favorite restaurant.
I watched an episode of the Simpsons last night while eating dinner.
I made some watermelon-flavored jello and was reminded of my love for watermelon Jolly Ranchers.
i ate a great lunch today
I just cooked up a couple really tasty burgers and with the new spicy mustard saw I bought, they were perfect!
I made a delicious breakfast.
That coffee was already made when I woke up early.
I ate a very delicious rum cake.
I made an incredible dinner last night and today during lunch I had leftovers and it tasted even better than before. It made me so happy.
I made a tasty breakfast
I was happy when my mom made spaghetti. It was delicious.
Watching a movie and eating leftover chinese food. It was complete bliss.
I made a new smoothie mix for my snack before bedtime.
I found a great sale on onions.
Was given a bag of bacon bits, which was purchased at Costco.  Wasn't sure how good it would be, but tried it as a pizza topping.  It exceeded all expectations.
I went to lunch today with a close friend and we had a great time.
I ate delicious rice pudding
I had a great meal of fried cod and french fries that was delicious.
I'm finally getting back into my healthy eating plan and today I found out I lost a pound.
I had lunch at Red Robin with my coworker today.
my girlfriend baked me cookies
I noticed I lost some weight when I stepped on the scale. I haven't been eating great, but have been exercising, which is helping.
I got my favorite ice cream from the ice cream parlor
I ate some great leftover pepperoni pizza I found in the fridge for lunch.
A moment that made me happy was sitting down, eating and relaxing
I got some donuts from this local bakery and they are out of this world!
I successfully resisted the temptation to eat a high fat, high sugar cinnamon roll for breakfast.
I made and baked chocolate chip cookies.
The dinner she made was amazing. It was my favorite meal, Pork steaks and broccoli. It was very delicious and I got to enjoy every bit of it.
I enjoyed the great meal and drinks on my flight.
I ate my favorite pizza in my room at lunch
Bought a few pounds of crab legs and cooked them for lunch.
I discovered a package of cookies in the freezer that I had forgotten about.
I went to dinner with some friends, after a meeting.
I had steak for the first time in months.
I went out for Chinese food with my coworkers.
I ate dinner with my favorite person.
Eating a pizza
My co-worker bought coffee for the entire office.
I enjoyed making a delicious, healthy green pea soup with carrots and potatoes and then eating it.
I was happy when my new recipe came out very good.
I ate McDonald's for breakfast.
These lemon donuts I bought from Publix.
I have enough leftovers that i dont have to cook dinner tonight
I was able to enjoy a nice pleasant dinner with my family last night at the olive garden.
I made a turkey dinner.
I met a close friend for coffee.
I got to watch 2 nba basketball games after dinner and actually relaxed.
It made me happy when I ate dinner.
I treated myself to a second delicious cup of coffee in the afternoon.
I ate my breakfast on my back porch. I loved the warm sun.
Met my niece for a quick lunch at her favorite Italian restaurant.
I went out to lunch with my boyfriend and we sat outside while we ate and enjoyed our food together.
Made a new lunch for work.
I got to eat some great food from my mom that I hadn't had in awhile
I made myself a tasty dinner last night.
I went out for chinese food at lunch and didn't realize that I had 8 prior stars and this lunch would be free.
I opened my lunch bag and remember that I had packed leftover gourmet pizza for myself.
While leaving the store, I gave some food to a homeless man and he thanked me.
Had a delicious lunch
I got to eat food after I had been hungry all day.
I had lunch with my bests friends, which is somenthing we did regularly a while back, but is very rare at the moment. It was great.
My husband brought home some cookies & cream ice cream, something that I have not eaten in months. It was delicious.
I ate chipotle and it was really good!
I ate a delicious and healthy smoothie.
Learned to cook a new dish.
I ate a lot of food that I made.
We ate dinner as a family instead of everyone going different directions and eating separately or on the go.
Eating a BBQ pizza from Little Ceasars.
I got a Starbucks reward free drink and used it to get a Vanilla Latte.
I had some free lunch
I had lunch with a old high school friend.
I got my favorite ice cream cone.
When I ate my favorite dessert
I went without eating any chocolate, which is a big deal for me being a chocolate-lover trying to cut down on it.
I started a new diet and was able to control my urge to eat chocolate so far.
I got free coffee cake for breakfast.
completed all the reservations for my summer vacation.
I woke up and made a fresh pot of coffee, with beans I got from a local brewery
I was happy to have free lunch catered for work today.
There were two frozen waffles in the freezer when I had thought I had already eaten the last ones.
My son and I made lunch together as an activity for his school spring break.
I tried a new recipe for supper and everyone enjoyed it.
i drank a great coffee today
I made myself pizza for dinner and sampled some home brewed beer.
I had a good breakfast at a local deli.
I got Chinese food for lunch this afternoon as a treat for working through a ten hour day.
I made burritos at home for dinner for the very first time.
When I got home, I had a cup of coffee and ate my favorite burritos to relax.
Making myself a nice, hot cup of tea.
I made delicious rice pudding
I could finally eat solid foods again after being sick all last week.
I ate subway for lunch, I love subway
I ate my favorite food which was my dad's classic home cooked dumplings.
After a long day, I picked up a six pack of beer;  I'm in the process of enjoying it now.
I had a really good dinner last night.
Making dinner tonight and our meal came out perfectly for once, was very happy and enjoyable.
I had a really good breakfast.
Sunday night I had an extremely well cooked meal (which I cooked myself), and it was large and filling and satisfying. I pork loin, rubbed with garlic paste and coated in black pepper corns, which I seared in a pan and then finished by roasting in the oven with some potatoes, and I served the whole thing with hearty italian bread and pan gravy on top.
I met a girl at a coffee shop and got her phone number. Later went on date and had sexual realtions
The day that I ate a Portillo's chocolate cake shake. 

I learned how to cook a new cake recipe.
I had a totally crappy day at work, it was raining when I left the shop which was perfect for my mood. I got in my car, turned on the radio and surprise..more bad news. I decided to treat myself to a cup of coffee on the way home..instead of choosing the drive through I went inside to see what donuts looked fresh. I ordered my coffee donut to go and just as I was  about to pay I heard a voice behind me say, "I've got it". When I turned around I saw it was a guy from work who I don't really know but he's kind of cute. I thanked him, feeling my face getting red and said I'd see him tomorrow.
Eating the delicious ribs my wife made or dinner
My boyfriend and I were walking around a park at night playing Pokemon Go.
It was dark out and we were looking at a covered area that had a picnic table on it, considering bringing the kid down for a picnic the next day.
Seeing my overseas living friend after few months of time and having few beers with him.
When my family cooked my favorite food at night
When I ate at a new restaurant.
my mother surprised me by coming home with my favourite cooked meal
It's my friends birthday and we celebrated at lunch.
I saw a man eating potato
I was asked to make a batch of brownies that everyone liked last time. I didn't have enough brown sugar as per the instructions, so I mixed together white sugar and eyeballed how much molasses I would need. They came out much better than the brown sugar ones last time, and I got more compliments on them.
Getting very silly with old friends on the Saturday night, and laughing way too far into the night, at a professional conference.Picking the most tasty tomatoes ever from our garden, grown from the seeds of the most tasty tomatoes we grew last year, and having so many, we had to make sauce.
I was happy this weekend when I had a quesadilla bun cheese burger with tots for din-din.
When I went for dinner to a nice restaurant with my girlfriend.
Yes. Last month we have went Singapore for family trip. Yes we enjoyed lot and visited many places and had different foods. Lot of sea foods. Especially me and my brother likes fishes very mush. So we had lot of fishes. Really unforgettable movements of my life.
I got a free donuts coupon.
My girlfriend and I were walking past month around a park at night playing Pokemon Go. It was dark out and we were looking at a covered area that had a picnic table on it, considering bringing the kid down for a picnic the next day.
Going out to drink with my friends made me happy.
i made a chicken biriyani last week
I had a lovely time cooking a new meal with my partner.
I made an exceptionally wonderful meal for our dinner.
Having a nice, relaxed dinner with my boyfriend last night made me happy.
I went to dinner with my girlfriend
I went to the dr. yesterday and got good BP numbers.
I was put on a new inhaler to replace the one that wasn't working for me.
My family and I laughed while eating dinner.
Catching my limit on fish on a day that I didn't expect to catch much, if anything.
I was very happy sitting down to a home-cooked meal with a group of good friends on Saturday night.
Today, a friend of mine gave me a coffee table for my living room for 100% free. I have been hunting for one for a long time!
My friends came over for dinner and we laughed until 10:00 pm.
I went to french fest and did a wine tasting, the wine was good and the woman I shared a table with was nice and fun to talk to.

I enjoyed a steak dinner at a local restaurant.
The bakery had my favorite pastry.
My neighbor and I went for ice cream cones yesterday.
I made a vacation reservation to celebrate my child's birthday at Disney World.
Three weeks or so after its release, I was able to find a 4-pack of Founders' KBS, a rare beer especially in this part of the country.
Seeing my niece's face when I presented her with the princess castle cake I had made her.
When I walked into the coffee shop and saw that my friend was already there waiting for me.
I was very happy when I woke up on Sunday morning and my husband had already gone to the store, made breakfast, gotten me coffee, and taken out the trash.
The most recent thing that made me happy was going out to coffee with my sister and spending time catching up on the news with each other.
I remember cooking a nice dinner for girlfriend last week.
It  was my daughter's Grand Marriage with  Beautiful Amenities and Quality food
I was happy this past month when my family and I went out to eat at the olive garden- it was a really happy and exciting time because I had not been to olive garden in 4 years and I really love their food.
I saw an young boy selling lemonade on the side of the road and it reminded me of my childhood.
The day that my kids were busy and I got to go all by myself and eat a Tom's Gryo

